{
  "schemaVersion": "1.0.0",
  "researchedOn": "2026-10-09",
  "scope": {
    "focus": [
      "Naruto and Naruto Shippuden techniques",
      "Twelve zodiac seals and selected special gestures",
      "Selected anime, movie and later-era variants, labelled individually"
    ],
    "exhaustive": false,
    "limitations": [
      "This is a bounded research catalogue, not every hand sign or technique across the franchise.",
      "Exact sequences are secondary-reported; original manga panels and anime footage have not been audited.",
      "Source medium is unspecified when the accessed infobox combines media without identifying a scene.",
      "Primary articles corroborate abilities and associations only unless a variant explicitly states otherwise.",
      "Sign geometry, one-handed variants and model training remain separate work.",
      "Effect suggestions are app design proposals, not canonical activation requirements."
    ]
  },
  "recognition": {
    "status": "untrained",
    "rejectLabels": [
      "unknown",
      "transition",
      "tracking_lost"
    ],
    "notes": [
      "Ordered steps are symbolic IDs, not a trained classifier or landmark thresholds.",
      "steps null means unresolved; an empty array is allowed only for an explicit no-seals report. Neither is a castable empty pattern.",
      "Repeated steps and special variants must not be collapsed; shared and prefix sequences need explicit disambiguation.",
      "Names and aliases do not establish mirroring equivalence, a particular hand count, or exact finger geometry."
    ]
  },
  "sources": [
    {
      "id": "src-general-hand-seal",
      "title": "Hand Seal — Narutopedia",
      "url": "https://naruto.fandom.com/wiki/Hand_Seal",
      "kind": "secondary_reference",
      "access": "search_excerpt",
      "notes": "Indexed sections Basic Hand Seals, Clone Seal, Clap Hands, Jin Seal, Seal of Confrontation and Seal of Reconciliation inspected. Original panels not inspected; names and descriptions only, not classifier geometry. Indexed sections on special seals and reduced-seal usage were read. This is a secondary reference; cited manga panels and anime footage were not inspected. Indexed sections Akimichi Seal, Shikamaru’s Bird Seal, Yamanaka Seals, and Byakugan Seals. Provisional geometry reference, not a training dataset. Indexed reference field inspected; original scene not inspected.",
      "accessedOn": "2026-10-09"
    },
    {
      "id": "src-general-clone-technique",
      "title": "Clone Technique — Narutopedia",
      "url": "https://naruto.fandom.com/wiki/Clone_Technique",
      "kind": "secondary_reference",
      "access": "search_excerpt",
      "notes": "Indexed Narutopedia article excerpt inspected; direct page fetch was blocked. Sequence not checked against original manga/anime.",
      "accessedOn": "2026-10-09"
    },
    {
      "id": "src-general-shadow-clone-technique",
      "title": "Shadow Clone Technique — Narutopedia",
      "url": "https://naruto.fandom.com/wiki/Shadow_Clone_Technique",
      "kind": "secondary_reference",
      "access": "search_excerpt",
      "notes": "Indexed Narutopedia article excerpt inspected; direct page fetch was blocked. Sequence not checked against original manga/anime.",
      "accessedOn": "2026-10-09"
    },
    {
      "id": "src-general-multiple-shadow-clone-technique",
      "title": "Multiple Shadow Clone Technique — Narutopedia",
      "url": "https://naruto.fandom.com/wiki/Multiple_Shadow_Clone_Technique",
      "kind": "secondary_reference",
      "access": "search_excerpt",
      "notes": "Indexed Narutopedia article excerpt inspected; direct page fetch was blocked. Sequence not checked against original manga/anime.",
      "accessedOn": "2026-10-09"
    },
    {
      "id": "src-general-transformation-technique",
      "title": "Transformation Technique — Narutopedia",
      "url": "https://naruto.fandom.com/wiki/Transformation_Technique",
      "kind": "secondary_reference",
      "access": "search_excerpt",
      "notes": "Indexed Narutopedia article excerpt inspected; direct page fetch was blocked. Sequence not checked against original manga/anime.",
      "accessedOn": "2026-10-09"
    },
    {
      "id": "src-general-body-replacement-technique",
      "title": "Body Replacement Technique — Narutopedia",
      "url": "https://naruto.fandom.com/wiki/Body_Replacement_Technique",
      "kind": "secondary_reference",
      "access": "search_excerpt",
      "notes": "Indexed Narutopedia article excerpt inspected; direct page fetch was blocked. Sequence not checked against original manga/anime.",
      "accessedOn": "2026-10-09"
    },
    {
      "id": "src-general-body-flicker-technique",
      "title": "Body Flicker Technique — Narutopedia",
      "url": "https://naruto.fandom.com/wiki/Body_Flicker_Technique",
      "kind": "secondary_reference",
      "access": "search_excerpt",
      "notes": "Indexed Narutopedia article excerpt inspected; direct page fetch was blocked. Sequence not checked against original manga/anime.",
      "accessedOn": "2026-10-09"
    },
    {
      "id": "src-general-summoning-technique",
      "title": "Summoning Technique — Narutopedia",
      "url": "https://naruto.fandom.com/wiki/Summoning_Technique",
      "kind": "secondary_reference",
      "access": "search_excerpt",
      "notes": "Indexed Narutopedia article excerpt inspected; direct page fetch was blocked. Sequence not checked against original manga/anime.",
      "accessedOn": "2026-10-09"
    },
    {
      "id": "src-general-summoning-impure-world-reincarnation",
      "title": "Summoning: Impure World Reincarnation — Narutopedia",
      "url": "https://naruto.fandom.com/wiki/Summoning%3A_Impure_World_Reincarnation",
      "kind": "secondary_reference",
      "access": "search_excerpt",
      "notes": "Indexed Narutopedia article excerpt inspected; direct page fetch was blocked. Sequence not checked against original manga/anime.",
      "accessedOn": "2026-10-09"
    },
    {
      "id": "src-general-dead-demon-consuming-seal",
      "title": "Dead Demon Consuming Seal — Narutopedia",
      "url": "https://naruto.fandom.com/wiki/Dead_Demon_Consuming_Seal",
      "kind": "secondary_reference",
      "access": "search_excerpt",
      "notes": "Indexed Narutopedia article excerpt inspected; direct page fetch was blocked. Sequence not checked against original manga/anime.",
      "accessedOn": "2026-10-09"
    },
    {
      "id": "src-general-shuriken-shadow-clone-technique",
      "title": "Shuriken Shadow Clone Technique — Narutopedia",
      "url": "https://naruto.fandom.com/wiki/Shuriken_Shadow_Clone_Technique",
      "kind": "secondary_reference",
      "access": "search_excerpt",
      "notes": "Indexed Narutopedia article excerpt inspected; direct page fetch was blocked. Sequence not checked against original manga/anime.",
      "accessedOn": "2026-10-09"
    },
    {
      "id": "src-general-temple-of-nirvana-technique",
      "title": "Temple of Nirvana Technique — Narutopedia",
      "url": "https://naruto.fandom.com/wiki/Temple_of_Nirvana_Technique",
      "kind": "secondary_reference",
      "access": "search_excerpt",
      "notes": "Indexed Narutopedia article excerpt inspected; direct page fetch was blocked. Sequence not checked against original manga/anime.",
      "accessedOn": "2026-10-09"
    },
    {
      "id": "src-general-demonic-illusion-hell-viewing-technique",
      "title": "Demonic Illusion: Hell Viewing Technique — Narutopedia",
      "url": "https://naruto.fandom.com/wiki/Demonic_Illusion%3A_Hell_Viewing_Technique",
      "kind": "secondary_reference",
      "access": "search_excerpt",
      "notes": "Indexed Narutopedia article excerpt inspected; direct page fetch was blocked. Sequence not checked against original manga/anime.",
      "accessedOn": "2026-10-09"
    },
    {
      "id": "src-general-demonic-illusion-tree-binding-death",
      "title": "Demonic Illusion: Tree Binding Death — Narutopedia",
      "url": "https://naruto.fandom.com/wiki/Demonic_Illusion%3A_Tree_Binding_Death",
      "kind": "secondary_reference",
      "access": "search_excerpt",
      "notes": "Indexed Narutopedia article excerpt inspected; direct page fetch was blocked. Sequence not checked against original manga/anime.",
      "accessedOn": "2026-10-09"
    },
    {
      "id": "src-general-bringer-of-darkness-technique",
      "title": "Bringer-of-Darkness Technique — Narutopedia",
      "url": "https://naruto.fandom.com/wiki/Bringer-of-Darkness_Technique",
      "kind": "secondary_reference",
      "access": "search_excerpt",
      "notes": "Indexed Narutopedia article excerpt inspected; direct page fetch was blocked. Sequence not checked against original manga/anime.",
      "accessedOn": "2026-10-09"
    },
    {
      "id": "src-general-chakra-scalpel",
      "title": "Chakra Scalpel — Narutopedia",
      "url": "https://naruto.fandom.com/wiki/Chakra_Scalpel",
      "kind": "secondary_reference",
      "access": "search_excerpt",
      "notes": "Indexed Narutopedia article excerpt inspected; direct page fetch was blocked. Sequence not checked against original manga/anime.",
      "accessedOn": "2026-10-09"
    },
    {
      "id": "src-general-mystical-palm-technique",
      "title": "Mystical Palm Technique — Narutopedia",
      "url": "https://naruto.fandom.com/wiki/Mystical_Palm_Technique",
      "kind": "secondary_reference",
      "access": "search_excerpt",
      "notes": "Indexed Narutopedia article excerpt inspected; direct page fetch was blocked. Sequence not checked against original manga/anime.",
      "accessedOn": "2026-10-09"
    },
    {
      "id": "src-general-five-elements-seal",
      "title": "Five Elements Seal — Narutopedia",
      "url": "https://naruto.fandom.com/wiki/Five_Elements_Seal",
      "kind": "secondary_reference",
      "access": "search_excerpt",